{
  "url": "https://example.com/",
  "language": "en",
  "maxPages": 30,
  "maxDepth": 3,
  "maxActionsPerPage": 8,
  "maxRuntimeMinutes": 30,
  "maxRepairIterations": 2,
  "allowedOrigins": ["https://example.com"],
  "requestDelayMs": 800,
  "allowMutations": false,
  "allowLocalFixture": false,
  "outputDirectory": "runs"
}
